,ID,Title,Summary,Species,Accession,Date,RelevanceScore,IndividualScore1,IndividualScore2,IndividualScore3,Justification1,Justification2,Justification3
32,200261624,Gene expression profile of all CD4 T cells from the mesenteric lymph nodes of SPF and Nippostrongylus Brasiliensis infected mice,"The discovery of naïve T cell transcriptional heterogeneity in specific-pathogen-free (SPF) mice represents a paradigm shift. While the ablation of Vista can alter the proportion of naïve CD4+ T cells with unique transcriptional signatures and the ‘readiness’ of the mice to break tolerance, the effect of non-heritable environmental exposures to commensals or infections remains entirely unknown. This is especially significant since individual variance in immune response, rather than being genetically inherited, is mostly attributed to environmental factors. Here we demonstrate that transcriptional heterogeneity characterizes even the germ-free (GF) mouse naïve CD4+ T cells. Naïve CD4+ T cell transcriptional subsets and their proportions were identical between GF, SPF and conventionalized GF mice, thus commensal-independent. Notwithstanding, Nippostrongylus brasiliensis (N.b.) infection altered the proportions of these transcriptional subsets, and the appearance of cells with a unique transcriptional signature. These naïve T cell-intrinsic changes accounted for the decreased immunization response of mice to an unrelated antigen. The compositional and functional changes in the naïve CD4+ T cell pool were dependent-variables of helminth infection, regressing with N.b. clearance. Therefore, naïve T cells are not uniformly uncommitted substrates for antigen-dependent activation but actively integrate environmental cues to permute the magnitude of the immune response.",Mus musculus,GSE261624,2024/07/25,1.5,1,1.0,1.0,This dataset examines CD4 T cell responses to a helminth infection but does not relate to lung cancer or immunotherapy specifically. The relevance is minimal as it touches on T cell biology but lacks direct connection to the research query.,"This dataset focuses on CD4 T cells in a mouse model and does not relate to lung cancer or immunotherapy, resulting in minimal relevance.","This dataset examines CD4 T cells in the context of a helminth infection, which is loosely related to immune responses but does not directly pertain to lung cancer or immunotherapy. The relevance is minimal as the focus is on T cell transcriptional changes rather than lung cancer immunotherapy."
33,200249265,Transcriptomics of BMDM treated with PTEN in the presence or absence of STAT1 inhibitors,PTEN binds to and regulates polarization of TAMs to enhance antitumor immunity and suppress tumor growth，We hope to investigate whether STAT1 mediates the polarization effect of PTEN on TAMs as a downstream factor,Mus musculus,GSE249265,2024/07/25,4.0,4,3.0,5.0,"This dataset investigates the role of PTEN in macrophage polarization and antitumor immunity. While it touches on immune response, its focus is not specifically on lung cancer or immunotherapy, leading to moderate relevance.","This dataset examines the role of PTEN in tumor-associated macrophages and antitumor immunity, which has potential implications for cancer therapies. However, the specific focus on macrophages and PTEN in a different context limits its direct relevance to lung cancer immunotherapy.","This dataset explores the role of PTEN in tumor-associated macrophages, which is relevant to cancer immunology. However, it does not specifically address lung cancer or immunotherapy, making it moderately relevant to the query."
34,200241625,Loss of Elp3 impairs the immune response to helminths by blocking intestinal tuft cell differentiation,"Intestinal tuft cells are critical in anti-helminth immunity by producing IL-25, which triggers IL-13 secretion by activated group 2 innate lymphoid cells (ILC2s) in order to ultimately expand both goblet and tuft cells. Translational reprogramming is involved in intestinal tuft cell differentiation but the role of tRNA modifications in this process is unknown. We show here that epithelial Elp3, a tRNA-modifying enzyme, promotes tuft cell differentiation and is consequently critical for IL-25 production, ILC2 activation, goblet cell expansion and control of N. brasiliensis infection in mice. Elp3 is essential for the IL-13-dependent induction of some glycolytic enzymes such as Hexokinase 1 and Aldolase A and consequently links specific metabolic pathways to tuft cell differentiation. Importantly, loss of epithelial Elp3 in the intestine blocks the translation of Nprl2, a mTORC1 inhibitor, which consequently enhances mTORC1 activation and stabilizes Atf4 in both transit amplifying and progenitor cells. Likewise, Atf4 overexpression in mouse intestinal epithelium blocks tuft cell differentiation and impairs the control of intestinal helminth infection. Collectively, our data define Atf4 as a negative regulator of tuft cell differentiation and provide insights into mechanisms through which some tRNA modifications promote a type 2 immune response to parasites in the intestine.",Mus musculus,GSE241625,2024/07/25,2.7,3,2.0,3.0,"This dataset explores tuft cell differentiation in the context of helminth infection, which is not directly related to lung cancer or immunotherapy, resulting in a somewhat low relevance score.","This dataset focuses on the role of Elp3 in intestinal tuft cell differentiation and anti-helminth immunity, which is not directly related to lung cancer or immunotherapy. The lack of relevance to the research query results in a low score.","This dataset focuses on tuft cell differentiation in helminth infections, which is not directly related to lung cancer or immunotherapy. The relevance to the query is low due to the lack of connection to lung cancer."
35,200271368,RNA-seq of live cell 3-D models with engineered genetic sub-types of lung cancer,"An experimental system was designed to screen for targetable signaling pathways linked to early 3D invasion in molecular subtypes, TP53 and LKB1, of KRAS-driven lung adenocarcinoma (LUAD). Live-cell imaging of human bronchial epithelial cells during 3D invasion was combined with RNA transcriptome profiling shown here.",Homo sapiens,GSE271368,2024/07/25,6.3,6,6.0,6.0,"This dataset involves RNA-seq of lung cancer models and aims to identify targetable signaling pathways. While it is relevant to lung cancer research, the focus on early 3D invasion and specific genetic subtypes may not directly align with immunotherapy strategies, leading to a moderate relevance score.","This dataset involves RNA-seq of lung cancer models and aims to identify targetable signaling pathways. While it is relevant to lung cancer research, the focus on early 3D invasion and specific genetic subtypes may not directly align with immunotherapy strategies, leading to a moderate relevance score.","This dataset involves RNA-seq of lung cancer models and aims to identify signaling pathways linked to invasion, which is relevant to lung cancer research. However, the focus on early 3D invasion and specific genetic subtypes may not directly address immunotherapy strategies, reducing its overall relevance."
36,200267325,RNA profiling of CSF resident macrophages and monocyte-macrophages from leptomeningeal metastasis mice,"We investigated the functional effect of dura-derived leptomeningeal matastasis (LM)-associated macrophages (dLAMs) on the cerebrospinal fluid (CSF) niche during LM outgrowth. Using lung cancer leptomeningeal metastasis models of Cx3cr1CreER:mTmG mice with tamoxifen administration, we achieved dLAMs and monocyte-macrophages via fluorescence-activated cell sorting (FACS). Then we performed bulk RNAseq analysis for these two cell populations.",Mus musculus,GSE267325,2024/07/24,3.0,2,3.0,4.0,"This dataset investigates macrophages in leptomeningeal metastasis, which may have implications for cancer biology but does not specifically address lung cancer or immunotherapy, leading to low relevance.","This dataset investigates macrophage responses in leptomeningeal metastasis models, which may have implications for lung cancer. However, the specific focus on macrophages and metastasis does not directly relate to immunotherapy for lung cancer, leading to a lower relevance score.","This dataset examines macrophages in a leptomeningeal metastasis model, which is related to cancer biology but not specifically lung cancer or immunotherapy. The relevance to the query is low due to the lack of direct connection to lung cancer."
37,200270333,Methionine Restriction Reduces Lung Cancer Progression and Increases Chemotherapy Response,Methionine restriction sensitizes A549 cells with and without LKB1 to chemotherapy,Homo sapiens,GSE270333,2024/07/19,6.0,6,6.0,6.0,"This dataset explores methionine restriction in lung cancer cells, which may have implications for chemotherapy response. While it does not directly address immunotherapy, its focus on lung cancer and treatment response is relevant.","This dataset explores methionine restriction in lung cancer cells, which may have implications for chemotherapy response. While it does not directly address immunotherapy, its focus on lung cancer and treatment response is relevant.","This dataset investigates the effects of methionine restriction on lung cancer progression and chemotherapy response, which is relevant to lung cancer treatment strategies. However, the specific focus on methionine restriction may not encompass broader immunotherapy approaches, limiting its overall relevance."
38,200239389,Prolyl hydroxylase domain enzyme PHD2 inhibits proliferation and metabolism in non–small cell lung cancer cells in HIF-dependent and HIF-independent manner,"Prolyl hydroxylase domain protein 2 (PHD2) is one of the intracellular oxygen sensors that mediates proteasomal degradation of hypoxia-inducible factor (HIF)-α via hydroxylation under normoxia. Because of its canonical function in the hypoxia signaling pathway, PHD2 is generally regarded as a tumor suppressor. However, the effects of PHD2 in tumorigenesis are not entirely dependent on HIF-α. Based on the data obtained from The Cancer Genome Atlas (TCGA) database, we found that the expression of PHD2 is upregulated in non-small cell lung cancer (NSCLC), which accounts for approximately 80-85% of lung cancers, suggesting that PHD2 may play an important role in NSCLC. However, the function of PHD2 in NSCLC remains largely unknown. In this study, we established PHD2-deficient H1299 cells to investigate the function of PHD2 in NSCLC, and found that PHD2 suppressed cell proliferation and metabolism, but induced ROS levels in human NSCLC cells. Further results indicated that the function of PHD2 in NSCLC is dependent on its enzymatic activity and partially independent of HIF. Moreover, we performed RNA-seq and transcriptomics analysis to explore the underlying mechanisms, and identified some potential targets and pathways regulated by PHD2, apart from the canonical HIF-mediated hypoxia signaling pathway. These results provide some clues to uncover novel roles of PHD2 in lung cancer progression.",Homo sapiens,GSE239389,2024/07/17,7.8,9,7.0,8.0,"This dataset focuses on PHD2 in non-small cell lung cancer (NSCLC), a major subtype of lung cancer. It discusses the role of PHD2 in tumorigenesis and its potential implications for immunotherapy, making it highly relevant to the research query.","This dataset investigates the role of PHD2 in non-small cell lung cancer (NSCLC) and its effects on cell proliferation and metabolism. The focus on NSCLC aligns well with the query, although it does not explicitly address immunotherapy strategies.",This dataset investigates the role of PHD2 in non-small cell lung cancer (NSCLC) and its effects on cell proliferation and metabolism. It is highly relevant to the query as it directly addresses lung cancer and provides insights into potential therapeutic targets.
39,200272045,Identification of mutant KRAS-related genes associated with malignant phenotypes in NSCLC,"Oncogenic KRAS is found in more than 25% of lung adenocarcinomas, the major histologic subtype of non–small cell lung cancer (NSCLC), and is an important target for drug development. To this end, we generated four NSCLC lines with stable knockdown selective for oncogenic KRAS. As expected, stable knockdown of oncogenic KRAS led to inhibition of in vitro and in vivo tumor growth in the KRAS-mutant NSCLC cells, but not in NSCLC cells that have wild-type KRAS (but mutant NRAS). Surprisingly, we did not see large-scale induction of cell death and the growth inhibitory effect was not complete. To further understand the ability of NSCLCs to grow despite selective removal of mutant KRAS expression, we conducted microarray expression profiling of NSCLC cell lines with or without mutant KRAS knockdown and isogenic human bronchial epithelial cell lines with and without oncogenic KRAS. We found that although the mitogen-activated protein kinase pathway is significantly downregulated after mutant KRAS knockdown, these NSCLCs showed increased levels of phospho-STAT3 and phospho–epidermal growth factor receptor, and variable changes in phospho-Akt. In addition, mutant KRAS knockdown sensitized the NSCLCs to p38 and EGFR inhibitors. Our findings suggest that targeting oncogenic KRAS by itself will not be sufficient treatment, but may offer possibilities of combining anti-KRAS strategies with other targeted drugs. Detailed information on the microarray results are available in a previous study (Sunaga N, et al. Mol Cancer Ther. 2011;10:336-46).",Homo sapiens,GSE272045,2024/07/16,8.5,9,8.0,9.0,"This dataset investigates KRAS mutations in NSCLC, which is a significant aspect of lung cancer biology. It explores the implications of targeting KRAS in treatment, aligning closely with the research focus on lung cancer and immunotherapy.","This dataset focuses on mutant KRAS in non-small cell lung cancer (NSCLC) and explores potential therapeutic strategies. The relevance to lung cancer and the identification of KRAS as a target aligns closely with the query on immunotherapies, though it does not directly discuss immunotherapy.",This dataset focuses on mutant KRAS in non-small cell lung cancer (NSCLC) and its implications for treatment strategies. It is extremely relevant to the query as it directly pertains to lung cancer and discusses potential therapeutic approaches.
