,ID,Title,Summary,Species,Accession,Date,RelevanceScore,IndividualScore1,IndividualScore2,IndividualScore3,Justification1,Justification2,Justification3
20,200246354,GCN2 is a determinant of the response to WEE1 kinase inhibition in small-cell lung cancer,"Patients with small-cell lung cancer (SCLC) are in dire need of more effective therapeutic options. Frequent disruption of the G1 checkpoint in SCLC cells creates a greater dependency of these cells on the G2/M checkpoint to maintain genomic integrity. Indeed, in pre-clinical models, inhibiting the G2/M kinase WEE1 shows promise in inhibiting SCLC growth. However, toxicity and acquired resistance limit the clinical effectiveness of this strategy. Here we conducted CRISPR/Cas9 knockout screens to identify genes influencing the response of SCLC cells to WEE1 kinase inhibition. These screens uncovered a role for the GCN2 amino acid-sensing pathway in modulating the response of SCLC cells to WEE1 inhibition. Rapid activation of GCN2 upon WEE1 inhibition triggers a stress response. Pharmacological activation of the GCN2 pathway synergizes with WEE1 inhibition. Thus, activation of the GCN2 amino acid-sensing pathway represents a novel approach for augmenting the efficacy of WEE1 inhibitors in SCLC.",Homo sapiens,GSE246354,2024/07/16,6.7,6,6.0,8.0,"This dataset focuses on small-cell lung cancer (SCLC) and explores the response to WEE1 kinase inhibition, which is relevant to lung cancer therapies. It investigates the GCN2 pathway, which may have implications for immunotherapy approaches. However, it lacks direct mention of immunotherapy strategies specifically, which limits its applicability to the query.","This dataset focuses on small-cell lung cancer (SCLC) and explores the response to WEE1 kinase inhibition, which is relevant to lung cancer therapies. The study identifies GCN2 as a modulator of this response, which could be significant for immunotherapy strategies. However, the specific focus on WEE1 inhibition may limit its direct applicability to broader immunotherapy approaches for lung cancer.","This dataset focuses on small-cell lung cancer (SCLC) and explores the response to WEE1 kinase inhibition, which is relevant to lung cancer therapies. The involvement of the GCN2 pathway in enhancing therapeutic efficacy aligns well with the query on immunotherapies for lung cancer. However, the specific focus on WEE1 inhibition rather than broader immunotherapy approaches slightly limits its direct applicability."
21,200269746,Detecting small cell transformation in patients with advanced EGFR mutant lung adenocarcinoma through epigenomic cfDNA profiling,"Histologic transformation to small cell lung cancer (SCLC) is an increasingly common resistance mechanism to EGFR tyrosine kinase inhibitors in EGFR mutant lung adenocarcinoma (LUAD) that is underdiagnosed in clinical practice due to the requirement for tissue biopsy. Early and accurate detection of transformed (t)SCLC has important prognostic and therapeutic implications. To address this unmet need, we first comprehensively profiled the epigenomes of metastatic lung tumors finding widespread epigenomic reprogramming during histologic transformation from LUAD to SCLC. We then utilized a novel approach for epigenomic profiling of cell-free DNA, which discriminated patients with EGFR mutant tSCLC from patients with EGFR mutant LUAD with greater than 90% accuracy. This first demonstration of the ability to accurately, and non-invasively, detect small cell transformation in patients with EGFR mutant LUAD through epigenomic cfDNA profiling is a critical step towards a new paradigm of diagnostic and therapeutic precision for patients with advanced lung cancer.",Homo sapiens,GSE269746,2024/06/20,8.0,7,8.0,9.0,"This dataset addresses the transformation of lung adenocarcinoma to small cell lung cancer (SCLC), which is a significant concern in lung cancer treatment. The use of epigenomic profiling to detect this transformation is innovative and could inform immunotherapy strategies. The focus on EGFR mutant lung adenocarcinoma is particularly relevant, though the dataset does not directly explore immunotherapy.","This dataset investigates the transformation of lung adenocarcinoma to small cell lung cancer (SCLC) and highlights the importance of early detection in the context of EGFR mutant lung cancer. The findings have significant implications for therapeutic strategies in lung cancer, particularly in understanding resistance mechanisms. The focus on lung cancer and the potential for improved diagnostic methods align closely with the research query on immunotherapies for lung cancer.","This dataset investigates the transformation of EGFR mutant lung adenocarcinoma to small-cell lung cancer (SCLC), which is highly relevant to lung cancer research and potential immunotherapy strategies. The focus on epigenomic profiling for early detection of transformed SCLC provides significant insights into therapeutic implications, closely aligning with the query's interest in lung cancer immunotherapies."
22,200249362,Non-Canonical BAF and mSWI/SNF Regulates POU2F3 and are Selective Targetable Dependencies for POU2F3-Positive Small Cell Lung Cancer,"~12% of SCLCs are marked by the lineage transcription factor POU2F3, which is essential in all POU2F3-positive SCLCs. Thus, approaches to directly or indirectly inhibit POU2F3 could lead to new therapeutic strategies for POU2F3-positive SCLCs. Here we use a positive selection screening strategy where endogenous POU2F3 is fused to the suicide gene DCK*. Cells that express endogenous POU2F3-DCK* are killed in the presence of the nucleoside analog BVdU and only cells that downregulate the POU2F3-DCK* fusion survive. Genome-wide CRISPR/Cas9 resistance screens with BVdU in POU2F3-DCK* cells uncovered that inactivation of SMARCD1 or BRD9, both components of the non-canonical BAF (ncBAF) complex, markedly downregulate endogenous POU2F3. We find that all POU2F3-positive SCLC cell lines relative to ASCL1-positive and NEUROD1-positive cell lines, are exquisitely sensitive to mSWI/SNF complex inhibition using SMARCA2/4 inhibitors; while pure non-neuroendocrine POU2F3-positive SCLC cell lines are highly sensitive to ncBAF complex inhibition using highly selective BRD9 degraders. Mechanistically, BRD9 binds and regulates POU2F3 target genes including POU2F3 itself. BRD9 degraders or SMARCA2/4 inhibitors robustly decrease accessibility of POU2F3 target genes effectively shutting off POU2F3 function. Moreover, BRD9 degraders or SMARCA2/4 inhibitors decrease tumor growth and increase survival of mice bearing non-neuroendocrine POU2F3 xenografts. This works shows that mSWI/SNF and ncBAF tightly regulate POU2F3 expression and activity and nominate mSWI/SNF or ncBAF inhibition as druggable therapeutic strategies to selectively target POU2F3-positive SCLCs.",Homo sapiens,GSE249362,2024/06/14,7.7,8,7.0,8.0,"This dataset examines POU2F3-positive SCLC and identifies potential therapeutic strategies targeting this transcription factor. The focus on small cell lung cancer and the identification of targetable dependencies align closely with the query on immunotherapies for lung cancer. However, while it suggests new therapeutic avenues, it does not explicitly discuss immunotherapy.","This dataset examines POU2F3-positive small cell lung cancer and identifies potential therapeutic strategies targeting this transcription factor. The focus on SCLC and the identification of druggable dependencies are relevant to lung cancer treatment strategies. However, the specific targeting of POU2F3 may not encompass the broader scope of immunotherapy approaches, limiting its overall relevance.","This dataset examines POU2F3-positive SCLC and identifies potential therapeutic strategies targeting this transcription factor, which is crucial for a subset of SCLC cases. The relevance to lung cancer and the exploration of therapeutic dependencies align well with the query, though the specific focus on POU2F3 may not encompass broader immunotherapy approaches."
23,200249258,Mammalian SWI/SNF complex activity regulates POU2F3 and constitutes a targetable dependency in small cell lung cancer,"Small cell lung cancers (SCLC) are comprised of heterogeneous subtypes marked by lineage-specific transcription factors, including ASCL1, NEUROD1, and POU2F3. POU2F3-positive SCLC, ~12% of all cases, are uniquely dependent on POU2F3 itself; as such, approaches to attenuate POU2F3 expression may represent new therapeutic opportunities for this subtype. Here using genome-scale CRISPR/Cas9-based screens reporting on POU2F3 expression in SCLC cell lines, we define mSWI/SNF complexes, including non-canonical BAF complexes (ncBAF), as top regulators of POU2F3 and dependencies specific to the POU2F3-positive subtype. Notably, clinical-grade pharmacologic mSWI/SNF complex inhibition attenuates proliferation of all POU2F3-positive SCLCs, while disruption of ncBAF via BRD9 degradation is uniquely effective in pure non-neuroendocrine POU2F3-SCLCs. mSWI/SNF complexes maintain accessibility over gene loci central to POU2F3-mediated gene regulatory networks. Finally, chemical targeting of SMARCA4/2 mSWI/SNF ATPases and BRD9 decrease POU2F3-SCLC tumor growth and increase survival in vivo. Taken together, these results define mSWI/SNF-mediated global governance of the POU2F3 oncogenic program and suggest mSWI/SNF inhibition as a therapeutic strategy in SCLC.",Homo sapiens,GSE249258,2024/06/14,7.7,8,7.0,8.0,"This dataset explores the regulation of POU2F3 in small cell lung cancer and identifies mSWI/SNF complexes as potential therapeutic targets. The focus on a specific subtype of lung cancer and the identification of targetable dependencies are highly relevant to the query. However, it does not directly address immunotherapy approaches.","This dataset explores the regulation of POU2F3 in small cell lung cancer and suggests therapeutic strategies targeting this pathway. The relevance to lung cancer is strong, and the identification of specific dependencies provides valuable insights for treatment approaches. However, the specific focus on POU2F3 may limit its applicability to the wider context of immunotherapy for lung cancer.","This dataset focuses on the regulation of POU2F3 in small cell lung cancer and identifies mSWI/SNF complexes as therapeutic targets. The relevance to lung cancer and the identification of potential druggable targets are significant, but the specificity of the focus on POU2F3 limits its broader applicability to immunotherapy strategies."
24,200242843,microarray in SCLC transformation,The histological transformation of lung adenocarcinoma (LUAD) to an aggressive neuroendocrine (NE) derivative resembling SCLC is a signature example of lineage plasticity in cancer.But the changes of gene expression need to be studied. We used microarrays to detail the global programme of gene expression under transformation and reversed transformation cells and identified distinct classes of up-regulated genes during this process.,Homo sapiens,GSE242843,2024/06/12,5.3,5,5.0,6.0,"This dataset investigates gene expression changes during the transformation of lung adenocarcinoma to SCLC. While it provides insights into lung cancer biology, the lack of specific therapeutic targets or immunotherapy relevance limits its applicability to the query.","This dataset focuses on the gene expression changes during the transformation of lung adenocarcinoma to SCLC, which is relevant to understanding lung cancer progression. However, the lack of specific details on immunotherapy or therapeutic implications limits its direct relevance to the query on immunotherapies for lung cancer.","This dataset explores gene expression changes during the transformation of lung adenocarcinoma to SCLC, which is relevant to lung cancer research. However, the lack of specific focus on immunotherapy and limited details on therapeutic implications reduce its overall relevance to the query."
25,200271368,RNA-seq of live cell 3-D models with engineered genetic sub-types of lung cancer,"An experimental system was designed to screen for targetable signaling pathways linked to early 3D invasion in molecular subtypes, TP53 and LKB1, of KRAS-driven lung adenocarcinoma (LUAD). Live-cell imaging of human bronchial epithelial cells during 3D invasion was combined with RNA transcriptome profiling shown here.",Homo sapiens,GSE271368,2024/07/25,6.3,6,6.0,6.0,"This dataset involves RNA-seq of lung cancer models and aims to identify targetable signaling pathways. While it is relevant to lung cancer research, the focus on early 3D invasion and specific genetic subtypes may not directly align with immunotherapy strategies, leading to a moderate relevance score.","This dataset involves RNA-seq of lung cancer models and aims to identify targetable signaling pathways. While it is relevant to lung cancer research, the focus on early 3D invasion and specific genetic subtypes may not directly align with immunotherapy strategies, leading to a moderate relevance score.","This dataset involves RNA-seq of lung cancer models and aims to identify signaling pathways linked to invasion, which is relevant to lung cancer research. However, the focus on early 3D invasion and specific genetic subtypes may not directly address immunotherapy strategies, reducing its overall relevance."
26,200267490,Expression changes in respiratory epithelial cells when treated with TGF-β1,"TGF-β1 is involved in various biological processes through downstream signals including SMAD, Akt, Erk, etc. TGF-β1 overexpressed by harmful stimuli can act as a causative factor in diseases such as accumulation of extracellular matrix and development of cancerous characteristics. Therefore, we sought to compare changes in expression of intracellular miRNAs to study diseases caused by TGF-β1. In our study, we aimed to discover therapeutic targets for TGF-β1-induced disease by investigating changes in miRNA expression and identifying the correlation between genes that can be regulated by miRNA.",Homo sapiens,GSE267490,2024/07/24,4.3,4,4.0,5.0,"This dataset examines the effects of TGF-β1 on respiratory epithelial cells, which may have implications for lung cancer. However, it lacks a clear focus on lung cancer or immunotherapy, resulting in a lower relevance score.","This dataset investigates the effects of TGF-β1 on respiratory epithelial cells, which may have implications for lung cancer. However, the focus on TGF-β1 and miRNA changes does not directly relate to immunotherapy for lung cancer, leading to a lower relevance score.","This dataset examines expression changes in respiratory epithelial cells treated with TGF-β1, which is related to cancer biology. However, it does not specifically address lung cancer or immunotherapy, making it less relevant to the query."
27,200230874,The DNA-repair protein APE1 contributes with hnRNPA2B1 to motif-enriched miRNA secretion,"The base excision repair (BER) Apurinic/apyrimidinic endonuclease 1 (APE1) enzyme is endowed with several non-repair activities, such as the cell response to genotoxic stress, the regulation of gene expression and miRNAs processing. We recently demonstrated that APE1 can be actively secreted by mammalian cells through exosomes. The role of APE1 in exosomes is still unknown, especially regarding the molecular mechanism involving small non-coding RNAs vesicular secretion. miRNAs loading into exosomes is a regulated and selective process, since not all the expressed miRNAs are indistinctly conveyed into exosomes. Through a dedicated transcriptomic analysis on cellular and vesicular small RNAs, we identified secreted miRNAs characterized by enriched sequence motifs and possible binding sites for APE1. In 50 out of 53 DE-miRNA precursors, we surprisingly found EXO motifs and proved that APE1 cooperates with hnRNPA2B1 for the EV-sorting of a subsets of miRNAs, including miR-1246, through a direct binding to GGAG stretch. We provide evidence of a new post-transcriptional role for this ubiquitous DNA-repair enzyme towards miRNAs secretion mechanisms, that could be exploited to interfere with tumor microenvironment.",Homo sapiens,GSE230874,2024/07/24,2.7,2,2.0,4.0,"This dataset focuses on the DNA-repair protein APE1 and its role in miRNA secretion. While it may have some relevance to cancer biology, it does not specifically address lung cancer or immunotherapy, leading to a low relevance score.","This dataset focuses on the role of APE1 in miRNA secretion and its implications for cancer biology. While it involves cancer, the specific focus on APE1 and miRNA does not align closely with the query regarding immunotherapies for lung cancer, resulting in a low relevance score.","This dataset focuses on APE1 and its role in miRNA secretion, which is more related to DNA repair mechanisms rather than lung cancer or immunotherapy. The relevance to the query is minimal due to the lack of direct connection to lung cancer."
28,200229792,Cancer cell stiffening via CoQ10 and UBIAD1 regulates ECM signaling and ferroptosis resistance in Breast Cancer,"Here, we discovered that CoQ10 and its biosynthetic enzyme UBIAD1 play a critical role in plasma membrane mechanical properties that are of interest for breast cancer (BC) progression and treatment. In detail, CoQ10 and UBIAD1 increased membrane fluidity leading to increased cell stiffness in BC. High UBIAD1/CoQ10 states impair lipid rafts and ECM-mediated oncogenic signaling and reduce the ferroptosis resistance of BC cells. Furthermore, analyses on BC patients and BC mouse models reveal that UBIAD1 loss is associated with BC development and progression. UBIAD1 expression in aggressive BC limits CTCs survival and lung metastasis formation in experimental xenograft assays.",Homo sapiens,GSE229792,2024/07/23,1.7,1,1.0,3.0,"This dataset investigates mechanisms in breast cancer and does not relate to lung cancer or immunotherapy, resulting in minimal relevance.","This dataset examines cancer cell stiffness and its implications in breast cancer, which is not relevant to lung cancer or immunotherapy. The lack of focus on lung cancer or related therapeutic strategies results in minimal relevance.","This dataset investigates mechanisms in breast cancer, which is not directly related to lung cancer or immunotherapy. The relevance to the query is low as it does not address the specific focus on lung cancer."
29,200270333,Methionine Restriction Reduces Lung Cancer Progression and Increases Chemotherapy Response,Methionine restriction sensitizes A549 cells with and without LKB1 to chemotherapy,Homo sapiens,GSE270333,2024/07/19,6.0,6,6.0,6.0,"This dataset explores methionine restriction in lung cancer cells, which may have implications for chemotherapy response. While it does not directly address immunotherapy, its focus on lung cancer and treatment response is relevant.","This dataset explores methionine restriction in lung cancer cells, which may have implications for chemotherapy response. While it does not directly address immunotherapy, its focus on lung cancer and treatment response is relevant.","This dataset investigates the effects of methionine restriction on lung cancer progression and chemotherapy response, which is relevant to lung cancer treatment strategies. However, the specific focus on methionine restriction may not encompass broader immunotherapy approaches, limiting its overall relevance."
30,200269394,Long-lived central memory gamma delta T cells confer protection against murine cytomegalovirus reinfection,"The involvement of γδ TCR-bearing lymphocytes in immunological memory has gained increasing interest due to their functional duality between adaptive and innate immunity. γδ T effector memory (TEM) and central memory (TCM) subsets have been identified, but their respective roles in memory responses are poorly understood. In the present study, we used subsequent mouse cytomegalovirus (MCMV) infections of αβ T cell deficient mice in order to analyze the memory potential of γδ T cells. As for CMV-specific αβ T cells, MCMV induced the accumulation of cytolytic, KLRG1+CX3CR1+ γδ TEM that principally localized in infected organ vasculature. Typifying T cell memory, γδ T cell expansion in organs and blood was higher and more efficient after secondary viral challenge than after primary infection. Viral control upon MCMV reinfection was prevented when masking γδ T-cell receptor, and was associated with a preferential amplification of private and unfocused TCR δ chain repertoire composed of a combination of clonotypes expanded post-primary infection and, more unexpectedly, of novel expanded clonotypes. Finally, long-term-primed γδ TCM cells, but not γδ TEM cells, protected T cell-deficient hosts against MCMV-induced death upon adoptive transfer, probably through their ability to survive and to generate TEM in the recipient host. This better survival potential of TCM cells was confirmed by a detailed scRNASeq analysis of these two γδ T cell subsets which also revealed their similarity to classically adaptive αβ CD8 T cells. Overall, our study uncovered memory properties of long-lived TCM γδ T cells that confer protection in a chronic infection, highlighting the interest of this T cell subset in vaccination approaches.",Mus musculus,GSE269394,2024/07/25,1.8,2,2.0,2.0,"The dataset focuses on γδ T cells and their role in immunological memory, which is somewhat related to immunotherapy. However, it does not specifically address lung cancer or the mechanisms of immunotherapy in that context, limiting its direct relevance.","This dataset investigates γδ T cells in a murine model, which may have implications for immunological memory but does not focus on lung cancer or relevant therapies, leading to low relevance.","This dataset focuses on γδ T cells and their role in viral infections, which is somewhat related to immunotherapy, but it does not specifically address lung cancer or immunotherapies for it. The relevance is low because the main biological concepts are not aligned with the query, which seeks datasets specifically related to lung cancer immunotherapy."
31,200267811,Effect of knockdown of GRP94 on gene expression of MKN-45 cells,"Anoikis resistance allows cancer cells to avoid death caused by detachment from the extracellular matrix's adhesion, enabling these cells to infiltrate and migrate to regions such as the peritoneum.Glucose-regulated protein 94 (GRP94, alternatively labeled as HSP90B1) is typically stress-induced and is part of the heat shock protein 90 (Hsp90) family.GRP94 is closely tied to cellular resistance to stress, apoptosis, proliferation, invasion, inflammation, and immunity.Our findings indicated that while attached culture didn't impact the apoptosis rate between shGRP94 and shCtrl groups, GRP94 knockdown weakened anoikis resistance, migration, and invasion abilities. Here, we aim to assess the impact of knocking down GRP94 on gene expression in the gastric cancer cell line MKN-45, to further elucidate potential molecular mechanisms by which GRP94 affects the biological characteristics of gastric cancer cells.",Homo sapiens,GSE267811,2024/07/25,3.0,3,2.0,4.0,"This dataset examines GRP94 in gastric cancer, which is not directly related to lung cancer or immunotherapy, resulting in a somewhat low relevance score.","This dataset explores the impact of GRP94 knockdown on gastric cancer cells, which is not directly related to lung cancer or immunotherapy. The focus on a different cancer type limits its relevance.","This dataset examines GRP94 in gastric cancer, which is not directly related to lung cancer or immunotherapy. The relevance to the query is minimal due to the lack of focus on lung cancer."
