,ID,Title,Summary,Species,Accession,Date,RelevanceScore,IndividualScore1,IndividualScore2,IndividualScore3,Justification1,Justification2,Justification3
22,200249258,Mammalian SWI/SNF complex activity regulates POU2F3 and constitutes a targetable dependency in small cell lung cancer,"Small cell lung cancers (SCLC) are comprised of heterogeneous subtypes marked by lineage-specific transcription factors, including ASCL1, NEUROD1, and POU2F3. POU2F3-positive SCLC, ~12% of all cases, are uniquely dependent on POU2F3 itself; as such, approaches to attenuate POU2F3 expression may represent new therapeutic opportunities for this subtype. Here using genome-scale CRISPR/Cas9-based screens reporting on POU2F3 expression in SCLC cell lines, we define mSWI/SNF complexes, including non-canonical BAF complexes (ncBAF), as top regulators of POU2F3 and dependencies specific to the POU2F3-positive subtype. Notably, clinical-grade pharmacologic mSWI/SNF complex inhibition attenuates proliferation of all POU2F3-positive SCLCs, while disruption of ncBAF via BRD9 degradation is uniquely effective in pure non-neuroendocrine POU2F3-SCLCs. mSWI/SNF complexes maintain accessibility over gene loci central to POU2F3-mediated gene regulatory networks. Finally, chemical targeting of SMARCA4/2 mSWI/SNF ATPases and BRD9 decrease POU2F3-SCLC tumor growth and increase survival in vivo. Taken together, these results define mSWI/SNF-mediated global governance of the POU2F3 oncogenic program and suggest mSWI/SNF inhibition as a therapeutic strategy in SCLC.",Homo sapiens,GSE249258,2024/06/14,7.3,8,8,6,"Attempt 1: Score 8 - This dataset explores the role of the SWI/SNF complex in small cell lung cancer (SCLC) and identifies potential therapeutic targets, aligning closely with the query on immunotherapies for lung cancer. The focus on a specific subtype of lung cancer enhances its relevance.","Attempt 2: Score 8 - This dataset investigates the SWI/SNF complex's role in regulating POU2F3 in small cell lung cancer (SCLC), which is directly relevant to lung cancer research. It explores potential therapeutic strategies, aligning well with the query's focus on immunotherapies for lung cancer.","Attempt 3: Score 6 - This dataset investigates the role of the SWI/SNF complex in regulating POU2F3 in small cell lung cancer (SCLC), which is a subtype of lung cancer. The focus on a specific lung cancer subtype aligns well with the query, though it doesn't directly address immunotherapy."
23,200271368,RNA-seq of live cell 3-D models with engineered genetic sub-types of lung cancer,"An experimental system was designed to screen for targetable signaling pathways linked to early 3D invasion in molecular subtypes, TP53 and LKB1, of KRAS-driven lung adenocarcinoma (LUAD). Live-cell imaging of human bronchial epithelial cells during 3D invasion was combined with RNA transcriptome profiling shown here.",Homo sapiens,GSE271368,2024/07/25,6.3,7,6,6,"Attempt 1: Score 7 - This dataset involves RNA-seq analysis of lung cancer models, specifically KRAS-driven lung adenocarcinoma. It is highly relevant as it examines molecular subtypes of lung cancer, though it does not explicitly focus on immunotherapy.","Attempt 2: Score 6 - This dataset involves RNA-seq of 3D models of lung cancer, specifically KRAS-driven lung adenocarcinoma. While it focuses on lung cancer, the connection to immunotherapy is less direct, as it primarily examines signaling pathways rather than immunotherapeutic approaches.","Attempt 3: Score 6 - This dataset involves RNA-seq of lung cancer models and examines signaling pathways related to lung adenocarcinoma. While it does not focus on immunotherapy, the relevance to lung cancer and the use of advanced methodologies make it applicable to the query."
24,200234161,Radiation dose heterogeneity primes response to immune checkpoint blockade to generate anti-tumor immunity,This SuperSeries is composed of the SubSeries listed below.,Mus musculus,GSE234161,2024/07/12,2.3,3,3,1,"Attempt 1: Score 3 - This dataset discusses radiation dose heterogeneity and immune checkpoint blockade, which is somewhat relevant to immunotherapy. However, it primarily focuses on radiation therapy rather than directly on lung cancer immunotherapy.","Attempt 2: Score 3 - This dataset discusses radiation dose heterogeneity and immune checkpoint blockade, which are related to cancer treatment. However, it does not specifically focus on lung cancer or immunotherapy, making its relevance somewhat low.","Attempt 3: Score 1 - This dataset discusses radiation dose and immune checkpoint blockade but does not specifically focus on lung cancer or immunotherapy, resulting in minimal relevance to the query."
25,200269394,Long-lived central memory gamma delta T cells confer protection against murine cytomegalovirus reinfection,"The involvement of γδ TCR-bearing lymphocytes in immunological memory has gained increasing interest due to their functional duality between adaptive and innate immunity. γδ T effector memory (TEM) and central memory (TCM) subsets have been identified, but their respective roles in memory responses are poorly understood. In the present study, we used subsequent mouse cytomegalovirus (MCMV) infections of αβ T cell deficient mice in order to analyze the memory potential of γδ T cells. As for CMV-specific αβ T cells, MCMV induced the accumulation of cytolytic, KLRG1+CX3CR1+ γδ TEM that principally localized in infected organ vasculature. Typifying T cell memory, γδ T cell expansion in organs and blood was higher and more efficient after secondary viral challenge than after primary infection. Viral control upon MCMV reinfection was prevented when masking γδ T-cell receptor, and was associated with a preferential amplification of private and unfocused TCR δ chain repertoire composed of a combination of clonotypes expanded post-primary infection and, more unexpectedly, of novel expanded clonotypes. Finally, long-term-primed γδ TCM cells, but not γδ TEM cells, protected T cell-deficient hosts against MCMV-induced death upon adoptive transfer, probably through their ability to survive and to generate TEM in the recipient host. This better survival potential of TCM cells was confirmed by a detailed scRNASeq analysis of these two γδ T cell subsets which also revealed their similarity to classically adaptive αβ CD8 T cells. Overall, our study uncovered memory properties of long-lived TCM γδ T cells that confer protection in a chronic infection, highlighting the interest of this T cell subset in vaccination approaches.",Mus musculus,GSE269394,2024/07/25,1.0,1,1,1,"Attempt 1: Score 1 - This dataset focuses on γδ T cells and their role in viral infections, which is not directly related to lung cancer or immunotherapy, resulting in minimal relevance.","Attempt 2: Score 1 - This dataset focuses on γδ T cells and their role in viral infection, which is not directly related to lung cancer or immunotherapy. Its relevance to the query is minimal.","Attempt 3: Score 1 - This dataset focuses on γδ T cells and their role in viral infections rather than lung cancer or immunotherapy, leading to minimal relevance."
26,200249265,Transcriptomics of BMDM treated with PTEN in the presence or absence of STAT1 inhibitors,PTEN binds to and regulates polarization of TAMs to enhance antitumor immunity and suppress tumor growth，We hope to investigate whether STAT1 mediates the polarization effect of PTEN on TAMs as a downstream factor,Mus musculus,GSE249265,2024/07/25,4.7,5,5,4,"Attempt 1: Score 5 - This dataset examines the role of PTEN in tumor-associated macrophages (TAMs) and antitumor immunity. While it addresses immune mechanisms, it does not specifically focus on lung cancer, limiting its direct applicability.","Attempt 2: Score 5 - This dataset explores the role of PTEN in tumor-associated macrophages (TAMs) and antitumor immunity. While it addresses immune responses, it does not specifically focus on lung cancer, limiting its direct applicability to the query.","Attempt 3: Score 4 - This dataset explores the role of PTEN in tumor-associated macrophages (TAMs) and antitumor immunity, which is relevant to cancer immunotherapy. However, it does not specifically address lung cancer, limiting its direct applicability."
27,200239389,Prolyl hydroxylase domain enzyme PHD2 inhibits proliferation and metabolism in non–small cell lung cancer cells in HIF-dependent and HIF-independent manner,"Prolyl hydroxylase domain protein 2 (PHD2) is one of the intracellular oxygen sensors that mediates proteasomal degradation of hypoxia-inducible factor (HIF)-α via hydroxylation under normoxia. Because of its canonical function in the hypoxia signaling pathway, PHD2 is generally regarded as a tumor suppressor. However, the effects of PHD2 in tumorigenesis are not entirely dependent on HIF-α. Based on the data obtained from The Cancer Genome Atlas (TCGA) database, we found that the expression of PHD2 is upregulated in non-small cell lung cancer (NSCLC), which accounts for approximately 80-85% of lung cancers, suggesting that PHD2 may play an important role in NSCLC. However, the function of PHD2 in NSCLC remains largely unknown. In this study, we established PHD2-deficient H1299 cells to investigate the function of PHD2 in NSCLC, and found that PHD2 suppressed cell proliferation and metabolism, but induced ROS levels in human NSCLC cells. Further results indicated that the function of PHD2 in NSCLC is dependent on its enzymatic activity and partially independent of HIF. Moreover, we performed RNA-seq and transcriptomics analysis to explore the underlying mechanisms, and identified some potential targets and pathways regulated by PHD2, apart from the canonical HIF-mediated hypoxia signaling pathway. These results provide some clues to uncover novel roles of PHD2 in lung cancer progression.",Homo sapiens,GSE239389,2024/07/17,8.7,9,9,8,Attempt 1: Score 9 - This dataset investigates the role of PHD2 in non-small cell lung cancer (NSCLC) and its impact on tumor growth. Its focus on lung cancer and potential therapeutic implications makes it extremely relevant to the query.,"Attempt 2: Score 9 - This dataset examines the role of PHD2 in non-small cell lung cancer (NSCLC), highlighting its potential as a target in lung cancer therapy. The focus on NSCLC and the exploration of mechanisms relevant to tumor biology make it highly relevant to the query.","Attempt 3: Score 8 - This dataset investigates the role of PHD2 in non-small cell lung cancer (NSCLC), highlighting its potential role in tumorigenesis and suggesting therapeutic implications. This aligns closely with the query regarding lung cancer and immunotherapy."
28,200246354,GCN2 is a determinant of the response to WEE1 kinase inhibition in small-cell lung cancer,"Patients with small-cell lung cancer (SCLC) are in dire need of more effective therapeutic options. Frequent disruption of the G1 checkpoint in SCLC cells creates a greater dependency of these cells on the G2/M checkpoint to maintain genomic integrity. Indeed, in pre-clinical models, inhibiting the G2/M kinase WEE1 shows promise in inhibiting SCLC growth. However, toxicity and acquired resistance limit the clinical effectiveness of this strategy. Here we conducted CRISPR/Cas9 knockout screens to identify genes influencing the response of SCLC cells to WEE1 kinase inhibition. These screens uncovered a role for the GCN2 amino acid-sensing pathway in modulating the response of SCLC cells to WEE1 inhibition. Rapid activation of GCN2 upon WEE1 inhibition triggers a stress response. Pharmacological activation of the GCN2 pathway synergizes with WEE1 inhibition. Thus, activation of the GCN2 amino acid-sensing pathway represents a novel approach for augmenting the efficacy of WEE1 inhibitors in SCLC.",Homo sapiens,GSE246354,2024/07/16,7.7,8,8,7,"Attempt 1: Score 8 - This dataset explores the response of small-cell lung cancer (SCLC) to WEE1 kinase inhibition, which is relevant to therapeutic strategies in lung cancer. Its focus on a specific subtype enhances its relevance.",Attempt 2: Score 8 - This dataset investigates the GCN2 pathway's role in modulating the response of small-cell lung cancer (SCLC) to WEE1 kinase inhibition. The focus on SCLC and potential therapeutic strategies aligns well with the query regarding immunotherapies for lung cancer.,"Attempt 3: Score 7 - This dataset examines the GCN2 pathway's role in modulating responses to WEE1 inhibition in small-cell lung cancer (SCLC). While it focuses on a specific therapeutic approach, it is relevant to the context of lung cancer and potential immunotherapy strategies."
29,200267811,Effect of knockdown of GRP94 on gene expression of MKN-45 cells,"Anoikis resistance allows cancer cells to avoid death caused by detachment from the extracellular matrix's adhesion, enabling these cells to infiltrate and migrate to regions such as the peritoneum.Glucose-regulated protein 94 (GRP94, alternatively labeled as HSP90B1) is typically stress-induced and is part of the heat shock protein 90 (Hsp90) family.GRP94 is closely tied to cellular resistance to stress, apoptosis, proliferation, invasion, inflammation, and immunity.Our findings indicated that while attached culture didn't impact the apoptosis rate between shGRP94 and shCtrl groups, GRP94 knockdown weakened anoikis resistance, migration, and invasion abilities. Here, we aim to assess the impact of knocking down GRP94 on gene expression in the gastric cancer cell line MKN-45, to further elucidate potential molecular mechanisms by which GRP94 affects the biological characteristics of gastric cancer cells.",Homo sapiens,GSE267811,2024/07/25,1.0,1,1,1,"Attempt 1: Score 1 - This dataset examines the effects of GRP94 knockdown in gastric cancer cells, which is not related to lung cancer or immunotherapy, leading to minimal relevance.","Attempt 2: Score 1 - This dataset focuses on GRP94 and its role in gastric cancer, which is unrelated to lung cancer. Its relevance to the query is minimal.","Attempt 3: Score 1 - This dataset focuses on GRP94 in gastric cancer, which is unrelated to lung cancer or immunotherapy, resulting in minimal relevance."
30,200272045,Identification of mutant KRAS-related genes associated with malignant phenotypes in NSCLC,"Oncogenic KRAS is found in more than 25% of lung adenocarcinomas, the major histologic subtype of non–small cell lung cancer (NSCLC), and is an important target for drug development. To this end, we generated four NSCLC lines with stable knockdown selective for oncogenic KRAS. As expected, stable knockdown of oncogenic KRAS led to inhibition of in vitro and in vivo tumor growth in the KRAS-mutant NSCLC cells, but not in NSCLC cells that have wild-type KRAS (but mutant NRAS). Surprisingly, we did not see large-scale induction of cell death and the growth inhibitory effect was not complete. To further understand the ability of NSCLCs to grow despite selective removal of mutant KRAS expression, we conducted microarray expression profiling of NSCLC cell lines with or without mutant KRAS knockdown and isogenic human bronchial epithelial cell lines with and without oncogenic KRAS. We found that although the mitogen-activated protein kinase pathway is significantly downregulated after mutant KRAS knockdown, these NSCLCs showed increased levels of phospho-STAT3 and phospho–epidermal growth factor receptor, and variable changes in phospho-Akt. In addition, mutant KRAS knockdown sensitized the NSCLCs to p38 and EGFR inhibitors. Our findings suggest that targeting oncogenic KRAS by itself will not be sufficient treatment, but may offer possibilities of combining anti-KRAS strategies with other targeted drugs. Detailed information on the microarray results are available in a previous study (Sunaga N, et al. Mol Cancer Ther. 2011;10:336-46).",Homo sapiens,GSE272045,2024/07/16,9.7,10,10,9,Attempt 1: Score 10 - This dataset identifies mutant KRAS-related genes in non-small cell lung cancer (NSCLC) and discusses their implications for treatment. It is perfectly relevant as it directly addresses lung cancer and potential therapeutic targets.,"Attempt 2: Score 10 - This dataset identifies mutant KRAS-related genes associated with malignant phenotypes in non-small cell lung cancer (NSCLC), directly addressing the query about lung cancer and potential therapeutic targets. It is perfectly relevant as it aligns with the focus on lung cancer and explores critical genetic factors.","Attempt 3: Score 9 - This dataset identifies genes associated with KRAS mutations in non-small cell lung cancer (NSCLC), a major target for lung cancer therapies. Its focus on KRAS and malignant phenotypes makes it extremely relevant to the query."
31,200218225,CRISPR screen of radiation resistant genes in NSCLC,"Radiotherapy is an important treatment for non-small cell lung cancer (NSCLC). It not only kills tumor cells directly, but also promotes the efficacy of immunotherapy. However, resistance to radiotherapy is still an unavoidable clinical challenge. In this study, we used radiation-sensitive H460 cell line to stably express Cas9 and CRISPR GeCKO v2 library (A and B). Then a single 4GY irradiation was given, and after the cells resumed proliferation, the total genome was extracted and second-generation sequencing was performed. Genes directly associated with resistance to radiotherapy were identified in comparison to controls without any treatment.",Homo sapiens,GSE218225,2024/07/12,7.0,6,7,8,"Attempt 1: Score 6 - This dataset involves a CRISPR screen for radiation resistance in NSCLC, which relates to treatment strategies, including immunotherapy. While relevant, it focuses more on resistance mechanisms rather than direct immunotherapy.","Attempt 2: Score 7 - This dataset involves a CRISPR screen for radiation-resistant genes in NSCLC, which is relevant to lung cancer treatment strategies. While it focuses on radiotherapy rather than immunotherapy, the insights gained could inform immunotherapeutic approaches, making it highly relevant.","Attempt 3: Score 8 - This dataset investigates genes associated with radiation resistance in NSCLC, which is relevant to both lung cancer and potential immunotherapy strategies, particularly in enhancing treatment efficacy."
32,200273081,Disparate pathways for extrachromosomal DNA biogenesis and genomic DNA repair,"Oncogene amplification on extrachromosomal DNA (ecDNA) is a pervasive driver event in cancer, yet our understanding of how ecDNA forms is limited. Here, we couple a CRISPR-based method for ecDNA induction with extensive characterization of newly formed ecDNA to examine their biogenesis. We find that DNA circularization is efficient, irrespective of 3D genome context, with formation of 800kb, 1 Mb, and 1.8 Mb ecDNAs reaching or exceeding 15%. We show non-homologous end joining and microhomology-mediated end joining both contribute to ecDNA formation, while inhibition of DNA-PKcs and ATM have opposing impacts on ecDNA formation. EcDNA and the corresponding chromosomal excision scar can form at significantly different rates and respond differently to DNA-PKcs and ATM inhibition. Taken together, our results support a model of ecDNA formation in which double strand break ends dissociate from their legitimate ligation partners prior to joining of illegitimate ends to form the ecDNA and excision scar.",Homo sapiens,GSE273081,2024/07/25,1.7,2,2,1,"Attempt 1: Score 2 - This dataset explores extrachromosomal DNA in cancer but does not specifically address lung cancer or immunotherapy, resulting in low relevance.",Attempt 2: Score 2 - This dataset discusses extrachromosomal DNA in cancer but does not specifically address lung cancer or immunotherapy. Its relevance to the query is low due to the lack of focus on lung cancer.,"Attempt 3: Score 1 - This dataset focuses on extrachromosomal DNA in cancer without specific relevance to lung cancer or immunotherapy, leading to minimal relevance."
33,200242843,microarray in SCLC transformation,The histological transformation of lung adenocarcinoma (LUAD) to an aggressive neuroendocrine (NE) derivative resembling SCLC is a signature example of lineage plasticity in cancer.But the changes of gene expression need to be studied. We used microarrays to detail the global programme of gene expression under transformation and reversed transformation cells and identified distinct classes of up-regulated genes during this process.,Homo sapiens,GSE242843,2024/06/12,3.7,4,3,4,"Attempt 1: Score 4 - This dataset studies gene expression changes during the transformation of lung adenocarcinoma to SCLC. While it relates to lung cancer, it does not directly address immunotherapy, leading to moderate relevance.","Attempt 2: Score 3 - This dataset examines gene expression changes during the transformation of lung adenocarcinoma to small-cell lung cancer (SCLC). While it relates to lung cancer, it does not directly address immunotherapy, resulting in low relevance.","Attempt 3: Score 4 - This dataset examines gene expression changes during the transformation of lung adenocarcinoma to small-cell lung cancer (SCLC). While it is relevant to lung cancer, it does not directly address immunotherapy, limiting its applicability."
34,200223266,Intramyocardial Sprouting Tip Cells Specify Coronary Arterialization,"The elaborate patterning of coronary arteries critically supports the high metabolic activity of the beating heart. How coronary endothelial cells coordinate hierarchical vascular remodeling and achieve arteriovenous specification remains largely unknown. Understanding the molecular and cellular cues that pattern coronary arteries is crucial to develop innovative therapeutic strategies that restore functional perfusion within the ischemic heart. Single-cell transcriptomics were used to delineate heterogeneous transcriptional states of the developing and mature coronary endothelium with a focus on sprouting endothelium and arterial cell specification. We discovered that a tip-cell-to-artery specification mechanism drives arterialization of the intramyocardial plexus and endocardial tunnels throughout life. We also identified non-overlapping intramyocardial and subepicardial tip cell populations with differential gene expression profiles and regulatory pathways, suggesting that differential sprouting programs govern the formation and specification of the venous and arterial coronary plexus.",Mus musculus,GSE223266,2024/07/25,1.0,1,1,1,"Attempt 1: Score 1 - This dataset focuses on coronary artery development and does not relate to lung cancer or immunotherapy, resulting in minimal relevance.",Attempt 2: Score 1 - This dataset focuses on coronary artery development and does not relate to lung cancer or immunotherapy. Its relevance to the query is minimal.,"Attempt 3: Score 1 - This dataset focuses on coronary arterialization and does not relate to lung cancer or immunotherapy, resulting in minimal relevance."
