,ID,Title,Summary,Species,Accession,Date,RelevanceScore,IndividualScore1,IndividualScore2,IndividualScore3,Justification1,Justification2,Justification3
10,200272474,SUMOylation inhibition potentiates CAR T activity against Multiple Myeloma (scRNA-Seq),"Chimeric antigen receptor (CAR)-T cell therapy has shown remarkable clinical efficacy against hematologic malignancies; however, tumor relapse occurs commonly due to T cell dysfunction presenting as exhaustion and loss of effector function. Here, we identified SUMOylation inhibition promoted T cell effector function and prevented T cell exhaustion. Combination of SUMO E1 inhibitor TAK-981, significantly potentiated CAR T cell anti-tumor activity and improved persistence of CAR-presenting T cells in vivo, presenting a potent novel therapeutic approach.",Homo sapiens,GSE272474,2024/07/18,1.0,1,1.0,1.0,"This dataset focuses on CAR T cell therapy for multiple myeloma, which is unrelated to lung cancer or immunotherapy in that context. The relevance is minimal due to the different cancer type.","This dataset focuses on CAR T cell therapy in multiple myeloma, which is unrelated to lung cancer. The relevance is minimal as it does not pertain to the query regarding lung cancer immunotherapy.","This dataset focuses on CAR T-cell therapy in multiple myeloma, which is unrelated to lung cancer. The lack of any relevant genes, diseases, or methodologies pertaining to lung cancer limits its applicability to the research query."
11,200272300,SUMOylation inhibition potentiates CAR T activity against multiple myeloma (RNA-Seq),"Chimeric antigen receptor (CAR)-T cell therapy has shown remarkable clinical efficacy against hematologic malignancies; however, tumor relapse occurs commonly due to T cell dysfunction presenting as exhaustion and loss of effector function. Here, we identified SUMOylation inhibition promoted T cell effector function and prevented T cell exhaustion. Combination of SUMO E1 inhibitor TAK-981, significantly potentiated CAR T cell anti-tumor activity and improved persistence of CAR-presenting T cells in vivo, presenting a potent novel therapeutic approach.",Homo sapiens,GSE272300,2024/07/18,1.0,1,1.0,1.0,"Similar to the previous dataset, this one also focuses on CAR T cell therapy for multiple myeloma, lacking any relevance to lung cancer or immunotherapy for lung cancer.","Similar to dataset 200272474, this dataset investigates CAR T cell therapy in multiple myeloma, making it irrelevant to lung cancer immunotherapy. The relevance is minimal.","Similar to the previous dataset, this one investigates CAR T-cell therapy in multiple myeloma. There is no connection to lung cancer or immunotherapy for lung cancer, resulting in minimal relevance."
12,200265937,Analysis of CD70 wild type or CD70 knock out CD70-specific nanoCAR T cells [RNA-Seq],"CD70 is an attractive target for chimeric antigen receptor (CAR) T-cell therapy for the treatment of both solid and liquid malignancies. However, the functionality of CD70-specific CAR T-cells is modest. We optimized a CD70-specific VHH-based CAR (nanoCAR). We evaluated the nanoCARs in clinically relevant models in vitro, using co-cultures of CD70-specific nanoCAR T-cells with malignant rhabdoid tumor organoids, and in vivo using a diffuse large B-cell lymphoma (DLBCL) patient-derived xenograft (PDX) model. Whereas the nanoCAR T-cells were highly efficient in organoid co-cultures, they showed only modest efficacy in the PDX model. Fratricide was not causing this loss in efficacy but rather CD70 interaction in cis with the nanoCAR, as validated by imaging flowcytometry, induces exhaustion. Knocking out CD70 expression in nanoCAR T-cells using CRISPR/Cas9, resulted in dramatically enhanced functionality in the DLBCL PDX model. Through single-cell transcriptomics, we obtained evidence that CD70 knock out (KO) CD70-specific nanoCAR T-cells were protected from antigen-induced exhaustion. In addition, we were able to demonstrate that WT CD70-specific nanoCAR T-cells already exhibit signs of exhaustion shortly after production. Their gene signature strongly overlapped with gene signatures of exhausted CAR T-cells. On the other hand, the gene signature of KO nanoCAR T-cells overlapped with the gene signature of CAR T-cell infusion products that led to complete responses in chronic lymphatic leukemia patients. Our data show that CARs targeting endogenous T-cell antigens, negatively affect CAR T-cell functionality by inducing an exhausted state, which can be overcome by knocking out the specific target, in this case CD70.",Homo sapiens,GSE265937,2024/06/17,1.0,1,1.0,1.0,"This dataset investigates CD70-specific CAR T cells in a different cancer context, which does not relate to lung cancer or immunotherapy for lung cancer. The relevance is minimal.","This dataset focuses on CD70-specific CAR T cells in other malignancies, which does not relate to lung cancer immunotherapy. The relevance is minimal as it does not address the query.","This dataset focuses on CD70-specific CAR T-cells in the context of solid and liquid malignancies, but does not address lung cancer. The lack of relevant biological concepts related to lung cancer limits its applicability to the research query."
13,200227435,Analysis of CD70 wild type or CD70 knock out CD70-specific nanoCAR T cells,"CD70 is an attractive target for chimeric antigen receptor (CAR) T cell therapy as treatment for both solid and liquid malignancies. However, functionality of CD70-specific CAR T cells is only modest. Here, we optimized a CD70-specific VHH based CAR (nanoCAR). We evaluated the nanoCARs in clinically relevant models in vitro, using co-cultures of CD70-specific nanoCAR T cells with malignant rhabdoid tumor organoids, and in vivo by using a diffuse large B cell lymphoma (DLBCL) patient-derived xenograft (PDX) model. Whereas the nanoCAR T cells were highly efficient in organoid co-cultures, they showed only modest efficacy in the PDX model. Knocking out CD70 expression in the nanoCAR T cells resulted in dramatically enhanced functionality in the PDX model, suggesting that CD70 interaction in cis with the nanoCAR induces exhaustion. Through single-cell transcriptomics, we obtained evidence that CD70 KO CD70-specific nanoCAR T cells are protected from antigen-induced exhaustion. Our data show that CARs targeted to endogenous T cell antigens, negatively affect CAR T cell functionality by inducing an exhausted state, which can be overcome by knocking out the specific target, in this case CD70.",Homo sapiens,GSE227435,2024/06/17,1.0,1,,,"This dataset also investigates CD70-specific CAR T cells in different cancer types, which is not relevant to lung cancer. The relevance is minimal as it does not pertain to the query.",,
14,200265904,GLUT1 overexpression enhances CAR T cell metabolic fitness and anti-tumor efficacy,"The tumor microenvironment presents many obstacles to effective CAR T cell therapy, including glucose competition from tumor and myeloid cells. Using mouse models of acute lymphoblastic leukemia (ALL), renal cell carcinoma (RCC), and glioblastoma (GBM), we show that enforced expression of the glucose transporter GLUT1 enhances anti-tumor efficacy and promotes favorable CAR T cell phenotypes for two clinically relevant CAR designs, 19-28z and IL13Ra2-BBz. In the NALM6 ALL model, 19-28z-GLUT1 promotes Tscm formation and prolongs survival. RNA sequencing of these CAR T cells reveals that overexpression of GLUT1, but not GLUT3, enriches for genes involved in glycolysis, mitochondrial respiration, and memory precursor phenotypes. Extending these data, 19-28z-GLUT1 CAR T cells improve tumor control and response to rechallenge in an RCC patient derived xenograft model. Furthermore, IL13Ra2-BBz CAR T cells overexpressing GLUT1 prolong survival of mice bearing orthotopic GBMs and exhibit decreased exhaustion markers. This novel engineering approach can offer a competitive advantage to CAR T cells in harsh tumor environments where glucose is limiting.",Homo sapiens,GSE265904,2024/05/30,1.0,1,1.0,1.0,"This dataset focuses on CAR T cell therapy in various cancers, but does not address lung cancer or immunotherapy specifically. Therefore, its relevance is minimal.","This dataset focuses on CAR T cell therapy in various cancers, which does not specifically address lung cancer. The relevance is minimal as it does not relate to the query.",This dataset examines GLUT1 in CAR T-cell therapy across different cancers but does not specifically address lung cancer. The lack of direct relevance to lung cancer immunotherapy results in a low score.
15,200270741,Ceramide metabolism alterations contribute to Tumor Necrosis Factor-induced melanoma dedifferentiation and predict resistance to immune checkpoint inhibitors in advanced melanoma patients [WM35],"Introduction: Advanced cutaneous melanoma is a skin cancer characterized by a poor prognosis and high metastatic potential. During metastatic spread, melanoma cells often undergo dedifferentiation toward an invasive phenotype, resulting in reduced expression of microphthalmia-associated transcription factor (MITF)-dependent melanoma antigens and facilitating immune escape. Tumor Necrosis Factor (TNF) is known to be a key factor in melanoma dedifferentiation. Interestingly, accumulating evidence suggests that TNF may play a role in melanoma progression and resistance to immunotherapies. Additionally, TNF has been identified as a potent regulator of sphingolipid (SL) metabolism, which could contribute to melanoma aggressiveness and the process of melanoma dedifferentiation. Methods: We conducted RNA sequencing and mass spectrometry analyses to investigate TNF-induced dedifferentiation in two melanoma cell lines. In vitro experiments were performed to manipulate sphingolipid metabolism using genetic or pharmacologic alterations in combination with TNF treatment, aiming to elucidate the potential involvement of this metabolism in TNF-induced dedifferentiation. Lastly, to evaluate the clinical significance of our findings, we performed unsupervised analysis of plasma sphingolipid levels in 48 patients receiving treatment with immune checkpoint inhibitors, either alone or in combination with anti-TNF therapy. Results: Herein, we demonstrate that TNF-induced melanoma cell dedifferentiation is associated with a global modulation of sphingolipid metabolism. Specifically, TNF decreases the expression and activity of acid ceramidase (AC), encoded by the ASAH1 gene, while increasing the expression of glucosylceramide synthase (GCS), encoded by the UGCG gene. Remarkably, knockdown of AC alone via RNA interference is enough to induce melanoma cell dedifferentiation. Furthermore, treatment with Eliglustat, a GCS inhibitor, inhibits TNF-induced melanoma cell dedifferentiation. Lastly, analysis of plasma samples from patients treated with immune checkpoint inhibitors, with or without anti-TNF therapy, revealed significant predictive sphingolipids. Notably, the top 8 predictive sphingolipids, including glycosphingolipids, were associated with a poor response to immunotherapy. Discussion: Our study highlights that ceramide metabolism alterations are causally involved in TNF-induced melanoma cell dedifferentiation and suggests that the evolution of specific ceramide metabolites in plasma may be considered as predictive biomarkers of resistance to immunotherapy.",Homo sapiens,GSE270741,2024/07/24,6.7,8,8.0,6.0,"This dataset investigates TNF-induced dedifferentiation in melanoma and its implications for resistance to immune checkpoint inhibitors, which is highly relevant to immunotherapy. Although it focuses on melanoma rather than lung cancer, the insights into immune resistance mechanisms are applicable.","This dataset investigates TNF-induced dedifferentiation in melanoma and its implications for resistance to immune checkpoint inhibitors, which is highly relevant to immunotherapy. Although it focuses on melanoma rather than lung cancer, the insights into immune resistance mechanisms are applicable.","This dataset investigates TNF-induced dedifferentiation in melanoma and its implications for immune checkpoint inhibitors, which is relevant to the broader context of immunotherapy. However, it specifically focuses on melanoma rather than lung cancer, which limits its direct applicability to the query."
16,200270740,Ceramide metabolism alterations contribute to Tumor Necrosis Factor-induced melanoma dedifferentiation and predict resistance to immune checkpoint inhibitors in advanced melanoma patients [A375],"Introduction: Advanced cutaneous melanoma is a skin cancer characterized by a poor prognosis and high metastatic potential. During metastatic spread, melanoma cells often undergo dedifferentiation toward an invasive phenotype, resulting in reduced expression of microphthalmia-associated transcription factor (MITF)-dependent melanoma antigens and facilitating immune escape. Tumor Necrosis Factor (TNF) is known to be a key factor in melanoma dedifferentiation. Interestingly, accumulating evidence suggests that TNF may play a role in melanoma progression and resistance to immunotherapies. Additionally, TNF has been identified as a potent regulator of sphingolipid (SL) metabolism, which could contribute to melanoma aggressiveness and the process of melanoma dedifferentiation. Methods: We conducted RNA sequencing and mass spectrometry analyses to investigate TNF-induced dedifferentiation in two melanoma cell lines. In vitro experiments were performed to manipulate sphingolipid metabolism using genetic or pharmacologic alterations in combination with TNF treatment, aiming to elucidate the potential involvement of this metabolism in TNF-induced dedifferentiation. Lastly, to evaluate the clinical significance of our findings, we performed unsupervised analysis of plasma sphingolipid levels in 48 patients receiving treatment with immune checkpoint inhibitors, either alone or in combination with anti-TNF therapy. Results: Herein, we demonstrate that TNF-induced melanoma cell dedifferentiation is associated with a global modulation of sphingolipid metabolism. Specifically, TNF decreases the expression and activity of acid ceramidase (AC), encoded by the ASAH1 gene, while increasing the expression of glucosylceramide synthase (GCS), encoded by the UGCG gene. Remarkably, knockdown of AC alone via RNA interference is enough to induce melanoma cell dedifferentiation. Furthermore, treatment with Eliglustat, a GCS inhibitor, inhibits TNF-induced melanoma cell dedifferentiation. Lastly, analysis of plasma samples from patients treated with immune checkpoint inhibitors, with or without anti-TNF therapy, revealed significant predictive sphingolipids. Notably, the top 8 predictive sphingolipids, including glycosphingolipids, were associated with a poor response to immunotherapy. Discussion: Our study highlights that ceramide metabolism alterations are causally involved in TNF-induced melanoma cell dedifferentiation and suggests that the evolution of specific ceramide metabolites in plasma may be considered as predictive biomarkers of resistance to immunotherapy.",Homo sapiens,GSE270740,2024/07/24,6.7,8,8.0,6.0,"Similar to the previous dataset, this one explores TNF-induced dedifferentiation in melanoma and its relationship with immune checkpoint inhibitors. The findings regarding resistance to immunotherapy are relevant, although the focus is on melanoma rather than lung cancer.","Similar to the previous dataset, this one explores TNF-induced dedifferentiation in melanoma and its relationship with immune checkpoint inhibitors. The findings regarding resistance to immunotherapy are relevant, although the focus is on melanoma rather than lung cancer.","Similar to dataset 200270741, this dataset explores TNF-induced dedifferentiation in melanoma and its resistance to immune checkpoint inhibitors. While it provides insights into immunotherapy resistance, it does not focus on lung cancer, resulting in moderate relevance."
17,200233098,STAT3 inhibition permits epigenetic reprogramming and TLR9/IRF8-driven differentiation of inv(16) acute myeloid leukemia [scRNA-seq],"Cultured acute myeloid leukemia (AML) blasts can differentiate into antigen-presenting cells but achieving leukemic cell immunogenicity proved challenging in clinical setting. Despite expressing multiple immunostimulatory receptors, such as Toll-like Receptor 9 (TLR9), AML cells resist immunostimulation. We previously demonstrated that eliminating Signal Transducer and Activator of Transcription 1 and 3 (STAT1/3) signaling in AML cells using decoy DNA strategy (CpG-STAT3dODN) synergized with TLR9 stimulation and resulted in T cell-mediated leukemia regression. Here, we interrogated the molecular underpinnings of CpG-STAT3dODN-driven differentiation and immunogenicity of mouse Cbfb/MYH11/Mpl AML. The transcriptional profiling of AML cells isolated from mice after inducible Stat3 silencing plus TLR9 stimulation or CpG-STAT3dODN treatment, revealed comparable upregulation of genes related to myeloid cell differentiation (Irf8, Cebpa) and immune stimulation (Gadd45a, Ciita, Il12a, Ifng) but decreased expression of leukemia-promoting Runx1 and Run1t1. The conditional Irf8 silencing in AML cells almost completely abrogated TLR9-driven leukemia cell differentiation. The AML cell reprogramming by CpG-STAT3dODN was likely regulated epigenetically as revealed by reduced global promoter hypomethylation of crucial myeloid cell differentiation and immune activation genes. These changes were associated with reduced expression of known STAT3 targets, DNMT1 and DNMT3a/b. Finally, we provide initial evidence of anti-leukemic effects of CpG-STAT3 inhibitor against human AML model in humanized mice. Our studies suggest that, beyond oncogenic functions, STAT3 in AML cells may be a primary checkpoint in control of immune-stimulatory and differentiation driving effects. These findings support further development of CpG-STAT3 inhibitors as a new bi-functional agents for AML immunotherapy.",Mus musculus,GSE233098,2024/07/23,1.0,1,1.0,1.0,"This dataset focuses on acute myeloid leukemia and its immunogenicity, which does not relate to lung cancer or immunotherapy in that context. The relevance is minimal.","This dataset investigates acute myeloid leukemia and its immunogenicity, which is unrelated to lung cancer. The relevance is minimal as it does not pertain to the query regarding lung cancer immunotherapy.","This dataset focuses on acute myeloid leukemia and its immunogenicity, which is not directly related to lung cancer or immunotherapy. The lack of relevant biological concepts pertaining to lung cancer limits its applicability to the research query."
18,200233097,STAT3 inhibition permits epigenetic reprogramming and TLR9/IRF8-driven differentiation of inv(16) acute myeloid leukemia [RRBS],"Cultured acute myeloid leukemia (AML) blasts can differentiate into antigen-presenting cells but achieving leukemic cell immunogenicity proved challenging in clinical setting. Despite expressing multiple immunostimulatory receptors, such as Toll-like Receptor 9 (TLR9), AML cells resist immunostimulation. We previously demonstrated that eliminating Signal Transducer and Activator of Transcription 1 and 3 (STAT1/3) signaling in AML cells using decoy DNA strategy (CpG-STAT3dODN) synergized with TLR9 stimulation and resulted in T cell-mediated leukemia regression. Here, we interrogated the molecular underpinnings of CpG-STAT3dODN-driven differentiation and immunogenicity of mouse Cbfb/MYH11/Mpl AML. The transcriptional profiling of AML cells isolated from mice after inducible Stat3 silencing plus TLR9 stimulation or CpG-STAT3dODN treatment, revealed comparable upregulation of genes related to myeloid cell differentiation (Irf8, Cebpa) and immune stimulation (Gadd45a, Ciita, Il12a, Ifng) but decreased expression of leukemia-promoting Runx1 and Run1t1. The conditional Irf8 silencing in AML cells almost completely abrogated TLR9-driven leukemia cell differentiation. The AML cell reprogramming by CpG-STAT3dODN was likely regulated epigenetically as revealed by reduced global promoter hypomethylation of crucial myeloid cell differentiation and immune activation genes. These changes were associated with reduced expression of known STAT3 targets, DNMT1 and DNMT3a/b. Finally, we provide initial evidence of anti-leukemic effects of CpG-STAT3 inhibitor against human AML model in humanized mice. Our studies suggest that, beyond oncogenic functions, STAT3 in AML cells may be a primary checkpoint in control of immune-stimulatory and differentiation driving effects. These findings support further development of CpG-STAT3 inhibitors as a new bi-functional agents for AML immunotherapy.",Mus musculus,GSE233097,2024/07/23,1.0,1,1.0,1.0,"Similar to the previous dataset, this one also focuses on acute myeloid leukemia and does not address lung cancer or immunotherapy, resulting in minimal relevance.","Similar to dataset 200233098, this dataset focuses on acute myeloid leukemia, making it irrelevant to lung cancer. The relevance is minimal.","Similar to the previous dataset, this one investigates AML and does not address lung cancer. The lack of relevant biological concepts related to lung cancer results in minimal relevance."
19,200233096,STAT3 inhibition permits epigenetic reprogramming and TLR9/IRF8-driven differentiation of inv(16) acute myeloid leukemia [RNASEQ_AML_DECSCR],"Cultured acute myeloid leukemia (AML) blasts can differentiate into antigen-presenting cells but achieving leukemic cell immunogenicity proved challenging in clinical setting. Despite expressing multiple immunostimulatory receptors, such as Toll-like Receptor 9 (TLR9), AML cells resist immunostimulation. We previously demonstrated that eliminating Signal Transducer and Activator of Transcription 1 and 3 (STAT1/3) signaling in AML cells using decoy DNA strategy (CpG-STAT3dODN) synergized with TLR9 stimulation and resulted in T cell-mediated leukemia regression. Here, we interrogated the molecular underpinnings of CpG-STAT3dODN-driven differentiation and immunogenicity of mouse Cbfb/MYH11/Mpl AML. The transcriptional profiling of AML cells isolated from mice after inducible Stat3 silencing plus TLR9 stimulation or CpG-STAT3dODN treatment, revealed comparable upregulation of genes related to myeloid cell differentiation (Irf8, Cebpa) and immune stimulation (Gadd45a, Ciita, Il12a, Ifng) but decreased expression of leukemia-promoting Runx1 and Run1t1. The conditional Irf8 silencing in AML cells almost completely abrogated TLR9-driven leukemia cell differentiation. The AML cell reprogramming by CpG-STAT3dODN was likely regulated epigenetically as revealed by reduced global promoter hypomethylation of crucial myeloid cell differentiation and immune activation genes. These changes were associated with reduced expression of known STAT3 targets, DNMT1 and DNMT3a/b. Finally, we provide initial evidence of anti-leukemic effects of CpG-STAT3 inhibitor against human AML model in humanized mice. Our studies suggest that, beyond oncogenic functions, STAT3 in AML cells may be a primary checkpoint in control of immune-stimulatory and differentiation driving effects. These findings support further development of CpG-STAT3 inhibitors as a new bi-functional agents for AML immunotherapy.",Mus musculus,GSE233096,2024/07/23,1.0,1,1.0,1.0,"This dataset investigates acute myeloid leukemia and its immunogenicity, which is unrelated to lung cancer or immunotherapy for lung cancer. The relevance is minimal.","This dataset also investigates acute myeloid leukemia and its immunogenicity, which does not relate to lung cancer. The relevance is minimal.","This dataset also focuses on AML and its immunogenicity, which is unrelated to lung cancer. The absence of relevant concepts pertaining to lung cancer limits its applicability to the research query."
